{
  "graph_version": "1.0",
  "graph_id": "sg.monopoly.phase11.20260415",
  "source_contract_id": "rsc.monopoly.phase11.20260415",
  "source_gate_id": "cg.monopoly.phase11.20260415",
  "nodes": [
    {
      "instance_id": "skill-board-topology",
      "capability_id": "gameplay-board-topology",
      "template_id": "monopoly.board_topology.phase1",
      "domain_type": "gameplay",
      "status": "pending",
      "allows_design_space_discovery": true,
      "convergence_priority": 1,
      "template_source": "plugin_skill_template",
      "planning_notes": [
        "棋盘拓扑是 Monopoly 主链的起点，先锁定 28 格、角格索引与移动方向。"
      ],
      "related_clarification_items": [],
      "gated_by_clarification_items": [],
      "dependencies": [],
      "coupling": [
        "skill-baseline-hud"
      ]
    },
    {
      "instance_id": "skill-tile-system",
      "capability_id": "gameplay-tile-system",
      "template_id": "monopoly.tile_event_dispatch.phase1",
      "domain_type": "gameplay",
      "status": "pending",
      "allows_design_space_discovery": true,
      "convergence_priority": 2,
      "template_source": "plugin_skill_template",
      "planning_notes": [
        "Tile System 负责格子类型、事件分发矩阵与 Phase 1 留空事件槽位。",
        "Chance / Community 在 Phase 1 的行为 -> accept_as_explicit"
      ],
      "related_clarification_items": [
        "cg-card-events-phase1"
      ],
      "gated_by_clarification_items": [],
      "dependencies": [
        "skill-board-topology"
      ],
      "coupling": [
        "skill-jail",
        "skill-baseline-hud"
      ]
    },
    {
      "instance_id": "skill-turn-loop",
      "capability_id": "gameplay-turn-loop",
      "template_id": "monopoly.turn_and_dice_flow.phase1",
      "domain_type": "gameplay",
      "status": "pending",
      "allows_design_space_discovery": true,
      "convergence_priority": 3,
      "template_source": "plugin_skill_template",
      "planning_notes": [
        "Turn Loop 组织掷骰、移动、过起点奖励与回合切换，是 gameplay 主骨架。",
        "最大游戏时长/僵局处理 -> clarification_required"
      ],
      "related_clarification_items": [
        "cg-max-game-length"
      ],
      "gated_by_clarification_items": [
        "cg-max-game-length"
      ],
      "dependencies": [
        "skill-board-topology",
        "skill-dice"
      ],
      "coupling": [
        "skill-dice"
      ]
    },
    {
      "instance_id": "skill-dice",
      "capability_id": "gameplay-dice",
      "template_id": "monopoly.turn_and_dice_flow.phase1",
      "domain_type": "gameplay",
      "status": "pending",
      "allows_design_space_discovery": true,
      "convergence_priority": 2,
      "template_source": "plugin_skill_template",
      "planning_notes": [
        "Dice 节点单独保留，方便后续把规则语义与表现反馈拆开处理。",
        "骰子表现与反馈节奏 -> send_to_design_space_discovery"
      ],
      "related_clarification_items": [
        "cg-dice-roll-feedback"
      ],
      "gated_by_clarification_items": [],
      "dependencies": [],
      "coupling": [
        "skill-turn-loop"
      ]
    },
    {
      "instance_id": "skill-economy",
      "capability_id": "gameplay-economy",
      "template_id": "monopoly.property_economy.phase1",
      "domain_type": "gameplay",
      "status": "pending",
      "allows_design_space_discovery": true,
      "convergence_priority": 4,
      "template_source": "plugin_skill_template",
      "planning_notes": [
        "Economy 负责购买、租金、支付与颜色组翻倍，不在此阶段选择具体表现方案。"
      ],
      "related_clarification_items": [],
      "gated_by_clarification_items": [],
      "dependencies": [
        "skill-tile-system",
        "skill-turn-loop"
      ],
      "coupling": [
        "skill-jail"
      ]
    },
    {
      "instance_id": "skill-player-management",
      "capability_id": "gameplay-player-management",
      "template_id": "monopoly.jail_and_bankruptcy.phase1",
      "domain_type": "gameplay",
      "status": "pending",
      "allows_design_space_discovery": true,
      "convergence_priority": 5,
      "template_source": "plugin_skill_template",
      "planning_notes": [
        "Player Management 负责玩家顺序、存活状态、淘汰与最终胜者归属。",
        "最大游戏时长/僵局处理 -> clarification_required",
        "玩家棋子视觉样式 -> accept_with_safe_default"
      ],
      "related_clarification_items": [
        "cg-max-game-length",
        "cg-player-token-visual-style"
      ],
      "gated_by_clarification_items": [
        "cg-max-game-length"
      ],
      "dependencies": [
        "skill-turn-loop",
        "skill-economy"
      ],
      "coupling": []
    },
    {
      "instance_id": "skill-jail",
      "capability_id": "gameplay-jail",
      "template_id": "monopoly.jail_and_bankruptcy.phase1",
      "domain_type": "gameplay",
      "status": "pending",
      "allows_design_space_discovery": true,
      "convergence_priority": 5,
      "template_source": "plugin_skill_template",
      "planning_notes": [
        "Jail 作为独立节点保留，便于后续把入狱、出狱与破产关系拆分审查。"
      ],
      "related_clarification_items": [],
      "gated_by_clarification_items": [],
      "dependencies": [
        "skill-turn-loop",
        "skill-player-management"
      ],
      "coupling": [
        "skill-tile-system",
        "skill-economy"
      ]
    },
    {
      "instance_id": "skill-baseline-start-screen",
      "capability_id": "baseline-start-screen",
      "template_id": "baseline.start_screen.presence_only",
      "domain_type": "baseline",
      "status": "pending",
      "allows_design_space_discovery": false,
      "convergence_priority": 6,
      "template_source": "future_baseline_template",
      "planning_notes": [
        "Start Screen 只规划入口能力，不在 Skill Graph 中决定具体实现形态。",
        "baseline_item=Start Screen"
      ],
      "related_clarification_items": [],
      "gated_by_clarification_items": [],
      "dependencies": [],
      "coupling": []
    },
    {
      "instance_id": "skill-baseline-main-menu",
      "capability_id": "baseline-main-menu",
      "template_id": "baseline.main_menu.presence_only",
      "domain_type": "baseline",
      "status": "pending",
      "allows_design_space_discovery": false,
      "convergence_priority": 6,
      "template_source": "future_baseline_template",
      "planning_notes": [
        "Main Menu 保持 presence_only，后续只验证入口流转与必要按钮能力。",
        "baseline_item=Main Menu"
      ],
      "related_clarification_items": [],
      "gated_by_clarification_items": [],
      "dependencies": [
        "skill-baseline-start-screen"
      ],
      "coupling": []
    },
    {
      "instance_id": "skill-baseline-settings",
      "capability_id": "baseline-settings",
      "template_id": "baseline.settings.presence_only",
      "domain_type": "baseline",
      "status": "pending",
      "allows_design_space_discovery": false,
      "convergence_priority": 5,
      "template_source": "future_baseline_template",
      "planning_notes": [
        "Settings 必须保留六项最低控件，但不在本阶段决定持久化实现细节。",
        "baseline_item=Settings",
        "设置持久化策略 -> accept_with_safe_default",
        "平台基础能力边界 -> clarification_required"
      ],
      "related_clarification_items": [
        "cg-platform-persistence",
        "cg-platform-foundation-boundary"
      ],
      "gated_by_clarification_items": [
        "cg-platform-foundation-boundary"
      ],
      "dependencies": [
        "skill-baseline-main-menu"
      ],
      "coupling": [
        "skill-baseline-audio-foundation",
        "skill-baseline-platform-foundation"
      ]
    },
    {
      "instance_id": "skill-baseline-pause",
      "capability_id": "baseline-pause",
      "template_id": "baseline.pause.presence_only",
      "domain_type": "baseline",
      "status": "pending",
      "allows_design_space_discovery": false,
      "convergence_priority": 5,
      "template_source": "future_baseline_template",
      "planning_notes": [
        "Pause 与 turn loop、input foundation 有耦合，但当前仍只做能力规划。",
        "baseline_item=Pause"
      ],
      "related_clarification_items": [],
      "gated_by_clarification_items": [],
      "dependencies": [
        "skill-baseline-settings",
        "skill-baseline-input-foundation"
      ],
      "coupling": [
        "skill-baseline-hud"
      ]
    },
    {
      "instance_id": "skill-baseline-results",
      "capability_id": "baseline-results",
      "template_id": "baseline.results.presence_only",
      "domain_type": "baseline",
      "status": "pending",
      "allows_design_space_discovery": false,
      "convergence_priority": 6,
      "template_source": "future_baseline_template",
      "planning_notes": [
        "Results 依赖胜负与淘汰语义，保留与 player management 的强关联。",
        "baseline_item=Results",
        "最大游戏时长/僵局处理 -> clarification_required"
      ],
      "related_clarification_items": [
        "cg-max-game-length"
      ],
      "gated_by_clarification_items": [
        "cg-max-game-length"
      ],
      "dependencies": [
        "skill-economy",
        "skill-player-management"
      ],
      "coupling": [
        "skill-baseline-hud"
      ]
    },
    {
      "instance_id": "skill-baseline-hud",
      "capability_id": "baseline-hud",
      "template_id": "baseline.hud.realization_eligible",
      "domain_type": "baseline",
      "status": "pending",
      "allows_design_space_discovery": true,
      "convergence_priority": 4,
      "template_source": "future_baseline_template",
      "planning_notes": [
        "HUD 是 realization_eligible baseline，允许进入后续 Design Space Discovery。",
        "baseline_item=HUD",
        "HUD 布局方式 -> send_to_design_space_discovery",
        "骰子表现与反馈节奏 -> send_to_design_space_discovery"
      ],
      "related_clarification_items": [
        "cg-hud-layout-style",
        "cg-dice-roll-feedback"
      ],
      "gated_by_clarification_items": [],
      "dependencies": [
        "skill-turn-loop",
        "skill-economy",
        "skill-player-management"
      ],
      "coupling": [
        "skill-board-topology",
        "skill-tile-system",
        "skill-baseline-pause",
        "skill-baseline-results",